,Date:,Time:,Location:,Operator:,Flight #:,Route:,AC  Type:,Registration:,cn / ln:,Aboard:,Fatalities:,Ground:,Summary:
ACCIDENT DETAILS,"November 11, 1947",?,"Gallup, New Mexico",American Airlines,10,San Francisco - Chicago - New York,Douglas DC-6,NC90741,43046/92,25 (passengers:21 crew:4),0 (passengers:? crew:?),0,"The aircraft was on a flight from San Francisco to Chicago when fire was reported on board. The aircraft crashed landed but there were no fatalities. An almost identical accident with the same cause occurred on 10/24/47. The flight crew transferred fuel either intentionally or inadvertently from the No. 4 alternate tanks to the No. 3 alternate tanks and failed to stop the transfer process in time to avoid overflowing the No. 3 alternate tank. Gasoline flowed through the No. 3 alternate vent line, out the vent, and was carried back by the slipstream, entering the cabin heater combustion air intake scoop. When the cabin heater came on, an explosion and fire occurred. Caused by a design flaw in the aircraft design which allowed vented fuel to be suck into the fresh air inlet."
ACCIDENT DETAILS,"November 13, 1947",?,"Near Bouchox, France",Société Auxiliare de Navigation Aérienne,?,?,Junkers Ju-52/3m,F-BDYH,AAC401,2 (passengers:0 crew:2),2 (passengers:0 crew:2),0,The cargo plane struck a mountain en route.
ACCIDENT DETAILS,"November 18, 1947",13:00,"Newcastle, Delaware",Trans Continental and Western Air,?,Training,Lockheed L-049-46-26 Constellation,NC86507,2028,5 (passengers:0 crew:5),5 (passengers:0 crew:5),0,"Crashed short of the runway and burst into flames. The inadvertent landing of the aircraft short of the runway. Inadequate air speed, improper use of power, and the adoption of an incorrect glide path."
ACCIDENT DETAILS,"November 18, 1947",15:00,"Ravello, Italy",Trafik-Turist-Transportflyg,?,Catania - Rome,Bristol 170 Freighter XI,SE-BNG,12792,25 (passengers:21 crew:4),20 (passengers:16 crew:4),0,"Strayed off course, stuck tree tops and then crashed into Mt. Santa Maria del Monte. Pilot's failure to realize the plane strayed off course and was in mountainous territory."
ACCIDENT DETAILS,"November 21, 1947",18:00,"Phouznicie, Romania",TARS,?,Bucurest - Prague,Lisunov Li-2,YR-TAI,18423509,26 (passengers:21 crew:5),13 (passengers:8 crew:5),0,"Crashed and burned on 2,000 ft. Tabor Peak in fog. The crew became lost after radio failure."
ACCIDENT DETAILS,"November 27, 1947",?,?,China National Aviation Corporation,?,?,Douglas DC-3,?,?,3 (passengers:0 crew:3),2 (passengers:0 crew:2),0,The cargo plane was shot down by communist anti -aircraft fire.
ACCIDENT DETAILS,"November 27, 1947",?,"Montenegrin Mountains, Yugoslavia",JAT Yugoslav Airlines,?,?,Douglas DC-3,YU-ABC,?,22 (passengers:19 crew:3),22 (passengers:19 crew:3),0,The aircraft crashed and burned 2 miles from Titograd airport while attempting to land in a snowstorm.
ACCIDENT DETAILS,"November 27, 1947",?,"Yakutat, Alaska",Columbia Air Cargo,?,Fairbanks - Yakutat,Douglas DC-3C,NC95486,6065,13 (passengers:11 crew:2),13 (passengers:11 crew:2),0,Crashed into trees while on approach to Yakutat. Failure to follow the approved instrument approach procedures while making an initial approach at an altitude insufficient to clear trees along the flight path.
ACCIDENT DETAILS,"November 28, 1947",14:10,"Near Trappa, Italy",Military - U.S. Air Force,?,?,Douglas C-47B,43-48736,?,20 (passengers:? crew:?),20 (passengers:? crew:?),0,"Drifting 30 miles off the prescribed course, the aircraft crashed into snow covered mountains. The wreckage was discovered 8 months later."
ACCIDENT DETAILS,"November 30, 1947",14:25,"Seattle, Washington",Alaska Airlines,009,Anchorage - Seattle,Douglas C-54A,NC-91009,7453,28 (passengers:25 crew:3),8 (passengers:7 crew:1),1,"The plane attempted to land at Seattle-Tacoma Airport but aborted the landing because of low ceiling and visibility. During a second landing attempt, the aircraft touched down 2,748 feet beyond the approach end of Runway 20, ran past the end of the runway, hit an automobile killing one person, crashed into a ditch and burst into flames. Caused by the landing of the airplane too far from the approach end of a wet runway and at a speed too great to accomplish a full stop on the runway."
ACCIDENT DETAILS,"December 10, 1947",00:20,"Near Goose Bay, Labrador",Military - U.S. Air Force,?,"Goose Bay - Westover Field, MS",Douglas C-54D-DC (DC-4),42-72572,10677,29 (passengers:25 crew:4),23 (passengers:22 crew:1),0,The aircraft crashed and burned in a wooded area shortly after taking off from Goose Bay. Snow falling at the time of the accident was a factor.
ACCIDENT DETAILS,"December 11, 1947",18:10,"Near Memphis, Tennessee",Military - U.S. Air Force,?,?,Douglas C-47-DK,44-76366,32698,20 (passengers:16 crew:4),20 (passengers:16 crew:4),0,"After preparing to land, the aircraft went into a right-hand spiral and crashed for reasons unknown."
ACCIDENT DETAILS,"December 18, 1947",08:45,"Krasnoyarsk, Russia",Aeroflot,6,Krasnoyarsk - Omsk,Ilyushin IL-12,L-1343,?,25 (passengers:20 crew:5),9 (passengers:3 crew:4),0,Crash landed due to engine failure after an attempted go-around.
ACCIDENT DETAILS,"December 23, 1947",?,"Kunming, China",Air Transport,?,?,Short S-29 Stirling V,OO-XAC,?,30 (passengers:? crew:?),25 (passengers:? crew:?),0,?
ACCIDENT DETAILS,"December 27, 1947",?,"Korangi Creek, India",Air India,?,Karachi - Bombay,Douglas DC-3 (C-47),VT-AUG,4175,23 (passengers:19 crew:4),23 (passengers:19 crew:4),0,"The aircraft lost control and crashed just after taking off. The captain losing control in conditions of poor visibility, resulted in the aircraft flying into the ground. The loss of control was most likely caused by inadequate illumination of the flying instruments due to faults in the lighting system. Decision to take off in poor weather conditions and faulty lighting system."
ACCIDENT DETAILS,"December 28, 1947",12:00,"Leon, Mexico",Servicio Aéreo Panini,?,Dorango - Leon - Mexico City,Douglas DC-2-172,XA-GEE,1408,9 (passengers:? crew:?),5 (passengers:? crew:?),3,Crashed near the Leon public square and destroyed 3 homes. Lost an engine while taking off and was attempting to return to the airport.
