,Date:,Time:,Location:,Operator:,Flight #:,Route:,AC  Type:,Registration:,cn / ln:,Aboard:,Fatalities:,Ground:,Summary:
ACCIDENT DETAILS,"November 26, 1977",02:30,"Near Beziers, France",Military - French Air Force,?,?,Nord 2501 Noratlas,182,?,34 (passengers:31 crew:3),34 (passengers:31 crew:3),0,Crashed into mountains north of the city in fog and adverse weather conditions.
ACCIDENT DETAILS,"November 29, 1977",19:17,"Pinehurst, North Carolina",Resort Air Service - Air Taxi,?,"Charlotte, NC - Pinehurst, NC",Beechcraft 58,N4461S,?,2 (passengers:1 crew:1),2 (passengers:1 crew:1),0,Hit trees short of the runway while on final approach in rain and fog. Aircraft observed flying low 3 miles from airport.
ACCIDENT DETAILS,"December 02, 1977",?,"Near Al Bayda, Lebanon",Balkan Bulgarian Airlines,?,Jeddah - Benghazi,Tupolev TU-154B,LZ-BTN,054,165 (passengers:159 crew:6),59 (passengers:59 crew:0),0,"After not being able to land at the scheduled airport due to fog, the crew could not find the alternate airport, ran out of fuel and crashed."
ACCIDENT DETAILS,"December 04, 1977",c 20:15,"Straits of Johore, near Kampung Ladang, Malaysia",Malaysia Airlines,653,Penang - Kuala Lumpur,Boeing B-737-2H6,9M-MBD,20585/306,100 (passengers:93 crew:7),100 (passengers:93 crew:7),0,"During a hijacking and while descending from 21,000 to 7,000 feet, both pilots were shot and the aircraft crashed into a swamp."
ACCIDENT DETAILS,"December 08, 1977",12:00,"Intracostal City, Louisiana",Petroleum Helicopter,?,?,SNIAS SA330J,N4730S,?,19 (passengers:18 crew:1),17 (passengers:16 crew:1),0,Collided with cable crane. Crane operator failed to park crane boom in stowed position.
ACCIDENT DETAILS,"December 09, 1977",19:25,"Tarko-Saley, USSR",Aeroflot,134,Tarko-Sale - Surgut,Antonov AN-24,CCCP-47695,27307602,23 (passengers:18 crew:5),17 (passengers:13 crew:4),0,The plane took off at night and entered a steep attitude after the flaps were raised and crashed.
ACCIDENT DETAILS,"December 11, 1977",11:00,"Hierro, Canary Islands",Military - U.S. Navy,?,?,Lockheed P-3B Orion,153428,185-5225,13 (passengers:0 crew:13),13 (passengers:0 crew:13),0,"Flew into a 4,200 ft. mountain at 1,200 ft."
ACCIDENT DETAILS,"December 13, 1977",19:22,"Evansville, Indiana","National Jet Services Inc., (Air Indiana)",216,Evansville - Nashville,Douglas DC-3,N51071,4837,29 (passengers:26 crew:3),29 (passengers:26 crew:3),0,"The plane crashed during takeoff in rain and fog. Killed, were the entire Evansville basketball team. The aileron on one wing and rudder remained locked upon takeoff, which made it extremely difficult to bank. An attempted takeoff with the rudder and right aileron control locks installed, in combination with a rearward center of gravity. Improperly loaded luggage which resulted in rearward center of gravity which resulted in the aircraft's rotating to a nose-high attitude immediately after takeoff and entering the region of reversed command from which the pilot was unable to recover."
ACCIDENT DETAILS,"December 14, 1977",14:15,"Davenport, Indiana",Straley Flying Service - Air Taxi,?,"Davenport, IA - Davenport, IA",Piper PA-34,N1634H,?,2 (passengers:1 crew:1),2 (passengers:1 crew:1),0,Crashed while in holding pattern to land. Icing of vertical stabilizer. Aircraft not equipped to fly in icing conditions.
ACCIDENT DETAILS,"December 18, 1977",?,"Off Madeira, Portugal",SATA,730,Geneva - Funchal,Aerospatiale Caravelle 10R,HB-ICK,200,57 (passengers:52 crew:5),36 (passengers:35 crew:1),0,Ditched into the ocean while on a second approach. Crew error. Sensory illusion.
ACCIDENT DETAILS,"December 18, 1977",01:38,"Near Salt Lake City, Utah",United Air Lines,2860,"San Francisco, CA - Salt Lake City, Utah",Douglas DC-8-54F,N8047U,45880/275,3 (passengers:0 crew:3),3 (passengers:0 crew:3),0,"While in a holding pattern because of electrical problems the cargo plane cashed into 7,600 ft. mountain. The approach controller's issuance and the flight crew's acceptance of an incomplete and ambiguous holding clearance in combination with the flight crew's failure to adhere to prescribed impairment-of-communications procedures and prescribed holding procedures. The controller's and flight crew's actions are attributed to probable habits of imprecise communication and of imprecise adherence to procedures developed through years of exposure to operations in a radar environment. Contributing to the accident was the failure of the aircraft's No.1 electrical system for unknown reasons."
ACCIDENT DETAILS,"December 19, 1977",07:48,"Vieques, Puerto Rico",Vieques Air Link,?,"St Croix, VI - Vieques, PR",Britten-Norman BN-2A Islander,N862JA,184,10 (passengers:9 crew:1),5 (passengers:5 crew:0),0,The plane made a forced landing in the ocean. Fuel exhaustion. Inadequate preflight planning. Mismanagement of fuel.
ACCIDENT DETAILS,"December 21, 1977",?,"Nanisivik, Canada",Kenn Borek Air,?,?,de Havilland Canada DHC-6 Twin Otter 300,CF-ABW,278,8 (passengers:6 crew:2),8 (passengers:6 crew:2),0,"The pilot lost control of the aircraft and crashed 2,200 ft. short of the runway in a 45 degree nose-down and right bank attitude while attempting to land. Unknown possible turbulence including windshear or mechanical failure of the flaps/ailerons."
ACCIDENT DETAILS,"December 22, 1977",12:42,"Giddings, Texas",Aviation Charter - Air Taxi,?,"Houston, TX - Austin, TX",Piper PA-28R,N116MM,?,2 (passengers:1 crew:1),2 (passengers:1 crew:1),0,Exceeded design stress limits of aircraft after experiencing airframe ice.
ACCIDENT DETAILS,"December 24, 1977",?,"Willemstad, Curacao, Netherlands Antilles",Valley Air Service,?,?,Piper PA-31-350 Navajo,?,?,10 (passengers:? crew:?),10 (passengers:? crew:?),0,?
ACCIDENT DETAILS,"December 29, 1977",?,"Cuenca, Ecuador",Servicios Aereos Nacionales,?,Guayaquil - Cuenca,Vickers Viscount 764 D,HC-BEM,183,24 (passengers:20 crew:4),24 (passengers:20 crew:4),0,Crashed into a hill while descending for a landing. Flying under VFR in IFR conditions.
