,Date:,Time:,Location:,Operator:,Flight #:,Route:,AC  Type:,Registration:,cn / ln:,Aboard:,Fatalities:,Ground:,Summary:
ACCIDENT DETAILS,"October 10, 1998",?,"Near Kindu, Congo",Congo Airline,?,Kindu - Kinshasa,Boeing B-727-30,9Q-CSG,18369/125,41 (passengers:38 crew:3),41 (passengers:38 crew:3),0,"The aircraft crashed into the jungle after the rear engine was hit by a Russian SA-7 missile, fired by Tutsi rebel forces shortly after the plane took off from Kindu Airport bound for Kinshasa."
ACCIDENT DETAILS,"October 21, 1998",08:52,"Fortaleza, Brazil",Capital Taxi Aereo,?,Teresina - Fortaleza,Embraer 120RT Brasilia,PT-WKH,120076,3 (passengers:1 crew:2),3 (passengers:1 crew:2),1,The cargo was on approach when it struck electrical cables and crashed into a house.
ACCIDENT DETAILS,"October 21, 1998",13:51,"Yerevan, Armenia",Ararat Avia,?,Yerevan - Krasnodar,Yakovlev YAK-40,EK-88272,9721053,37 (passengers:33 crew:4),0 (passengers:0 crew:0),4,"While attempting to take off, the aircraft struck a military bus as it crossed the runway."
ACCIDENT DETAILS,"October 25, 1998",?,"Rwenzori mountains, Uganda",TanaMana Aviation,?,?,Britten-Norman BN-2A-3 Islander,5Y-ANV,284,11 (passengers:10 crew:1),4 (passengers:3 crew:1),0,Crashed in the Rwenzori mountains.
ACCIDENT DETAILS,"November 01, 1998",13:14,"Near Quetzaltenango, Guatemala",Living Water Teaching Ministries Charter,?,Plaa Grande - Quetzaltenango,Douglas DC-3C,N3FY,20562,18 (passengers:16 crew:2),11 (passengers:9 crew:2),0,"The aircraft crashed into mountainous terrain in fog and rain 44 minutes after leaving Playa Grande, Guatemala. The plane was returning from doing a medical clinic for 3 days in the remote jungles of Playa Grande where no one had seen a doctor before."
ACCIDENT DETAILS,"November 11, 1998",11:22,"Near Krasnoyarsk, Russia",Sakha Airlines,?,Krasnoyarsk - Mirny,Antonov AN-12,RA-12955,08345506,13 (passengers:7 crew:6),13 (passengers:7 crew:6),0,"The aircraft, carrying freight and seven passengers, crashed and burned, 25 km from Krasnoyarsk, 4 minutes after taking off in a snowstorm. Icing."
ACCIDENT DETAILS,"November 17, 1998",?,"Koror, Nepal",Paradise Air,?,?,Cessna 207 Skywagon,RP-C606,207-00105,9 (passengers:7 crew:2),9 (passengers:7 crew:2),0,Crashed during a fourth visual approach attempt to Airai Airport in heavy rain.
ACCIDENT DETAILS,"November 21, 1998",17:43,"Edgewater, Maryland",Private,?,"Brunswick, GA - Annapolis, MD",Burgess RV-6 experimental,N956DB,21119,1 (passengers:0 crew:1),1 (passengers:0 crew:1),0,"The homebuilt plane was attempting to land at Lee Airport in Maryland when it crashed into Beard's Creek. coming to rest inverted in 18 feet of water. Actor, William Gardner Knight, 56, who was piloting the aircraft was killed. The pilot's failure to maintain adequate altitude/clearance from the trees. Contributing to the accident was the pilot's unfamiliarity with the geographic location and dark night conditions."
ACCIDENT DETAILS,"November 23, 1998",00:30,"Victoria, British Columbia",Regency Express Air,434,Vancouver - Victoria,Cessna 208B Caravan I Super Cargomaster,N9352B,208B-0061,2 (passengers:0 crew:2),2 (passengers:0 crew:2),0,"While en route, the cargo plane made a right turn in the vicinity of Beaver Point, and began to head towards high ground north of the Victoria airport. The aircraft then began a gradual, descending turn to the left in a southeasterly direction before striking trees near Mount Tuam peak. The crew would have encountered the lower ceiling in the vicinity of Beaver Point. This lower layer of cloud would have restricted the crew's view of the ground lighting and reduced the ambient lighting available to navigate by visual means. With the loss of ground references, it is unlikely that the crew would have been able to perceive the divergence of the aircraft's flight path away from its intended track by visual means. The crew was unable to maintain separation between the aircraft and the terrain by visual means."
ACCIDENT DETAILS,"November 27, 1998",?,"King Island, Tasmania",?,?,?,?,?,?,6 (passengers:5 crew:1),4 (passengers:? crew:?),0,Windshear or strong crosswinds caused the aircraft to crash as it was taking off.
ACCIDENT DETAILS,"December 02, 1998",12:16,"Umpire, Arkansas",Yates Aviation,?,"Mena, AR - Texarcana, TX",Cessna 501 Citation I SP,N501EZ,501-0058,1 (passengers:0 crew:1),1 (passengers:0 crew:1),0,"On a positioning flight, the aircrafted rolled over and crashed inverted 17 miles south of the airport it took off from. The pilot's in flight loss of control for undetermined reasons."
ACCIDENT DETAILS,"December 07, 1998",11:13,"Baie-Comeau, Canada",Air Satellite,?,Point-Lebel - Rimouski,Britten-Norman Trislander,C-FCVK,2028,10 (passengers:8 crew:2),7 (passengers:6 crew:1),0,"The aircraft crashed into the St. Lawrence River in shallow water, 2km from the runway after taking off from Point-Lebel."
ACCIDENT DETAILS,"December 11, 1998",19:10,"Near Surat Thani, Thailand",Thai Airways,261,Bangkok - Surat Thani,Airbus A-310-204,HS-TIA,415,146 (passengers:132 crew:14),102 (passengers:91 crew:11),0,"The plane crashed 2 miles southwest of Surat Thani Airport. The accident occurred in poor visibility and heavy rain. After a third landing attempt, the plane could not gain altitude and crashed into a paddy field. First reports suggest the aircraft stalled and pancaked into the ground tail first. Spatial disorientation when the nose pitched up sharply during a nighttime approach in stormy weather."
ACCIDENT DETAILS,"December 14, 1998",?,"Near Cuito, Angola",Khors Aircompany,?,?,Antonov AN-12BP,UR-11319,4342510,11 (passengers:6 crew:5),11 (passengers:6 crew:5),0,The leased aircraft was shot down by UNITA rebels as it flew at FL 150 carrying relief supplies.
ACCIDENT DETAILS,"December 17, 1998",?,"Saurimo, Angola",Zanex,?,Luanda - Saurimo,Antonov 12,S9-SAT,?,10 (passengers:? crew:?),1 (passengers:? crew:?),0,"After encountering a vehicle on the runway, the crew attempted a go-around but the aircraft touched down in a nose-high attitude and crashed."
ACCIDENT DETAILS,"December 22, 1998",00:15,"Medellín, Colombia",SELVA,?,Bogotá - Medellín,Antonov 32B,HK-3930X,3309,5 (passengers:2 crew:3),5 (passengers:2 crew:3),0,The cargo plane crashed in fog and poor visibility while attempting to land.
ACCIDENT DETAILS,"December 26, 1998",12:00,"Vila Nova, Angola",Transafrik,806,Huambo - Saurimo,Lockheed Martin L-100-30 Hercules,S9-CAO,4561,14 (passengers:10 crew:4),14 (passengers:10 crew:4),0,"The plane crashed in dense jungle, 25 km from the departure town of Huambo. Heavy fighting was reported between government forces and UNITA rebels at the time of the crash."
